{
  "$contract": "0.1",
  "id": "jaren-data-studio",
  "version": "1",
  "$defs": {
    "DbError": {
      "type": "object",
      "required": ["code", "message"],
      "properties": {
        "code": {
          "description": "The store's own coded refusal (a JD code) when it had one, null for an uncoded fault.",
          "type": ["string", "null"]
        },
        "message": { "type": "string" }
      }
    },
    "Collection": {
      "type": "string",
      "minLength": 1
    }
  },
  "operations": {
    "data.init": {
      "kind": "command",
      "output": {
        "type": "object",
        "required": ["topology", "vfs", "version"],
        "properties": {
          "topology": { "enum": ["owner", "client", "memory"] },
          "vfs": { "type": "string" },
          "version": { "type": "string" },
          "refusal": { "$ref": "#/$defs/DbError" }
        }
      },
      "errors": { "db": { "schema": { "$ref": "#/$defs/DbError" } } },
      "doc": "Load the SQLite wasm build and decide the topology: owner (holds the OPFS pool), client (another context owns it — talk over the channel), or memory (OPFS absent — standalone). refusal carries the coded downgrade when there is one."
    },
    "data.open": {
      "kind": "command",
      "input": {
        "type": "object",
        "required": ["model"],
        "properties": {
          "model": { "type": "object" },
          "reset": { "type": "boolean" }
        }
      },
      "output": {
        "type": "object",
        "required": ["vfs", "capabilities"],
        "properties": {
          "vfs": { "type": "string" },
          "capabilities": { "type": "object" }
        }
      },
      "errors": { "db": { "schema": { "$ref": "#/$defs/DbError" } } },
      "doc": "Open (or recreate, with reset) the store from a jaren-model document. capabilities is the store's own capabilities table, passed through. reset unlinks the database the owning context holds, so it is answered only in that context: a client tab asking for it is refused with the db failure rather than served."
    },
    "data.insert": {
      "kind": "command",
      "input": {
        "type": "object",
        "required": ["collection", "doc"],
        "properties": {
          "collection": { "$ref": "#/$defs/Collection" },
          "doc": { "type": "object" }
        }
      },
      "output": true,
      "errors": { "db": { "schema": { "$ref": "#/$defs/DbError" } } },
      "doc": "Insert one document. The output is the store's own insert result — the driver decides its shape, so it is deliberately open."
    },
    "data.delete": {
      "kind": "command",
      "input": {
        "type": "object",
        "required": ["collection", "key"],
        "properties": {
          "collection": { "$ref": "#/$defs/Collection" },
          "key": true
        }
      },
      "output": true,
      "errors": { "db": { "schema": { "$ref": "#/$defs/DbError" } } },
      "doc": "Delete by key. Keys may be strings, numbers or the model's own key shape, so the member is deliberately open, like the output."
    },
    "data.rows": {
      "kind": "read",
      "input": {
        "type": "object",
        "required": ["collection"],
        "properties": {
          "collection": { "$ref": "#/$defs/Collection" }
        }
      },
      "output": { "type": "array" },
      "errors": { "db": { "schema": { "$ref": "#/$defs/DbError" } } },
      "doc": "Every document of the collection, as the canonical scan query returns them."
    },
    "data.execute": {
      "kind": "read",
      "input": {
        "type": "object",
        "required": ["collection", "document"],
        "properties": {
          "collection": { "$ref": "#/$defs/Collection" },
          "document": true,
          "externals": { "type": "object" }
        }
      },
      "output": true,
      "errors": { "db": { "schema": { "$ref": "#/$defs/DbError" } } },
      "doc": "Run a query document. The query decides the output shape — an array pack answers rows, a bare FLWOR a sequence, an aggregate a scalar — so the output is deliberately open."
    },
    "data.explain": {
      "kind": "read",
      "input": {
        "type": "object",
        "required": ["collection", "document"],
        "properties": {
          "collection": { "$ref": "#/$defs/Collection" },
          "document": true,
          "externals": { "type": "object" }
        }
      },
      "output": {
        "type": "object",
        "properties": {
          "sql": { "type": "string" },
          "params": { "type": "array" },
          "indexes": { "type": "array" },
          "residual": { "type": ["object", "null"] }
        }
      },
      "errors": { "db": { "schema": { "$ref": "#/$defs/DbError" } } },
      "doc": "The store's explain record for a query document: the SQL pushed down, its parameters, the indexes chosen and the residual (null when fully pushed)."
    },
    "data.oracle": {
      "kind": "read",
      "input": {
        "type": "object",
        "required": ["model", "collection", "documents", "query"],
        "properties": {
          "model": { "type": "object" },
          "collection": { "$ref": "#/$defs/Collection" },
          "documents": { "type": "array", "items": { "type": "object" } },
          "query": true,
          "externals": { "type": "object" },
          "explain": {
            "description": "Also answer the store's explain record for the query — the SQL pushed down, the pre-filters and the database's own scan narrative — so a reader can see the plan the throwaway store ran, not only its answer.",
            "type": "boolean"
          }
        }
      },
      "output": {
        "type": "object",
        "required": ["answer", "empty"],
        "properties": {
          "answer": true,
          "empty": {
            "description": "The query answered the empty sequence, which JSON cannot spell and null must not stand in for — answer is null then, and means nothing.",
            "type": "boolean"
          },
          "explain": {
            "description": "Present only when asked for: the same record data.explain answers, over the throwaway store.",
            "type": "object",
            "properties": {
              "sql": { "type": "string" },
              "params": { "type": "array" },
              "indexes": { "type": "array" },
              "prefilters": { "type": "array" },
              "residual": { "type": ["object", "null"] },
              "scanNarrative": { "type": "string" }
            }
          }
        }
      },
      "errors": { "db": { "schema": { "$ref": "#/$defs/DbError" } } },
      "doc": "Run one query over a THROWAWAY store: a fresh in-memory store on the model, the documents inserted, the query executed (and explained, when explain is asked for), the store closed — whatever happened. The store this context holds is untouched: no registration, no announcement, and it works with no store open at all. It is how a second executor is held to the spatial corpus from a real browser tab, in every engine: the corpus needs execution, not persistence, so a tab whose OPFS pool is absent answers it exactly as an owner does."
    },
    "data.live": {
      "kind": "subscribe",
      "input": {
        "type": "object",
        "required": ["collection", "document"],
        "properties": {
          "collection": { "$ref": "#/$defs/Collection" },
          "document": true,
          "externals": { "type": "object" }
        }
      },
      "output": {
        "type": "object",
        "required": ["rows"],
        "properties": {
          "rows": { "type": "array" }
        }
      },
      "errors": { "db": { "schema": { "$ref": "#/$defs/DbError" } } },
      "doc": "Subscribe to a live query: the snapshot is LIVE's result document and every committed write follows as a { patch, seq } emission over the stream binding — RFC 6902 end to end. Unsubscribing is the wire's (the port unsubscribe frame)."
    },
    "data.lives": {
      "kind": "read",
      "output": {
        "type": "object",
        "required": ["count"],
        "properties": {
          "count": { "type": "integer", "minimum": 0 }
        }
      },
      "errors": { "db": { "schema": { "$ref": "#/$defs/DbError" } } },
      "doc": "The number of live registrations this store currently holds — the studio's status surface, and how a test observes that a departed tab's subscription was released."
    },
    "data.migrate": {
      "kind": "command",
      "input": {
        "type": "object",
        "required": ["to"],
        "properties": {
          "to": { "type": "object" },
          "id": { "type": "string" }
        }
      },
      "output": {
        "type": "object",
        "required": ["planned", "losses", "applied"],
        "properties": {
          "planned": { "type": "array", "items": { "type": "string" } },
          "losses": { "type": "array" },
          "applied": { "type": "array", "items": { "type": "string" } },
          "note": { "type": "string" }
        }
      },
      "errors": { "db": { "schema": { "$ref": "#/$defs/DbError" } } },
      "doc": "Plan a migration to a new model, shadow-verify and apply it (memory stores recreate instead — note says so), and reopen the store on the new model."
    }
  }
}
